{
  "adapter_version": "command.v1",
  "budget": {
    "correction_budget": 0,
    "timeout_seconds": 260.0
  },
  "cli_version": "1.18.34",
  "compatibility_fingerprint": "5c48e9ff333dda6f5148003a4bc0f3a9222bfa15937a81b1920bf05cbd075b8c",
  "condition": "playbook",
  "dataset_version": "3.1.0",
  "delivery_profile": "native-repo-skills-opencode-v1",
  "environment": {
    "digest": "72eaf56915cd3431385c6a8375603176f6785324c79bf127b437ba9e1b65bcf8",
    "workspace_policy": "fresh_fixture_copy"
  },
  "evaluation_mode": "empirical",
  "harness_version": "0.1.0",
  "identity_source": "declared",
  "memory_policy_version": "stateless_fixture_workspace.v1",
  "model": {
    "id": "deepseek-v4.1-flash",
    "parameters": "provider-default",
    "provider": "opencode-go"
  },
  "permission_policy_version": "workspace-tools-no-external-deny",
  "prompt_hash": "4e158db04b3b65e7f7f749dcdd920ccfbb7d50739099db19dab9952586616b20",
  "prompt_version": "native.backend.v1:playbook",
  "reasoning_profile": "provider-default",
  "retry_policy": "single_attempt_no_retry",
  "schema_version": "playbook.harness_eval_unit.v1",
  "scorer_version": "external_acceptance:1.0.0",
  "task_id": "backend",
  "timeout_seconds": 260.0,
  "tool_registry_version": "harness_lab_builtin.v1",
  "trial_index": 0,
  "unit_id": "playbook_native_v3-backend-playbook-0"
}
